{
  "schema_version": 1,
  "id": "STAGE-0001",
  "task_id": "TASK-0001",
  "title": "Project foundation",
  "goal": "Create Python skeleton",
  "acceptance_criteria": ["All checks pass"],
  "dependencies": [],
  "allowed_paths": ["pyproject.toml", "src/continuity/**"],
  "required_checks": [{"id": "PYTHON_VERSION", "argv": ["python", "-c", "import sys; raise SystemExit(0)"]}],
  "review_gates": ["GATE-01", "GATE-02"],
  "risk_level": "normal",
  "risk_reasons": [],
  "status": "active",
  "created_at": "2026-07-17T10:00:00+08:00",
  "updated_at": "2026-07-17T10:00:00+08:00"
}
